{
  "type": "pioneer-study",
  "id": "9af045aa-80ca-e743-92de-b31431abc547",
  "creationDate": "2020-04-24T20:04:10.285Z",
  "version": 4,
  "application": {
    "architecture": "x86-64",
    "buildId": "20200415104457",
    "name": "Firefox",
    "version": "77.0a1",
    "displayVersion": "77.0a1",
    "vendor": "Mozilla",
    "platformVersion": "77.0a1",
    "xpcomAbi": "x86_64-gcc3",
    "channel": "default"
  },
  "payload": {
    "encryptedData": "eyJhbGciOiJFQ0RILUVTIiwiZW5jIjoiQTI1NkdDTSIsImVwayI6eyJjcnYiOiJQLTI1NiIsImV4dCI6dHJ1ZSwia3R5IjoiRUMiLCJ4IjoiSFN5dXBzM1RWdEJ3V3JTTnFKMi1ycnd1LVVKdFVnbmtMTW9hOGJBNUVlayIsInkiOiItQmdTbzE3ZUZFRGlncC03emtEX0xEQVNVZ0xjdFNEZGk5NG9rYm1EYTkwIn19..Ri7NaZFlcHmg6IS4.ZnYhkv26B2g7Z7eXrIHGH69F_MxG99eLyiXdRzdZ8L2Y.OJ6eKSYuG3pcU5gEJo2thA",
    "encryptionKeyId": "pioneer-v2-study",
    "schemaNamespace": "pioneer-v2-study",
    "schemaName": "event",
    "schemaVersion": 1,
    "pioneerId": "9af045aa-80ca-e743-92de-b31431abc547",
    "studyName": "pioneer-v2-example@example.com"
  }
}
